{
  "schema_version": "1.0",
  "trial_id": "s10112026-J01-public_observed-r001-1",
  "observation_provenance_id": null,
  "pair_id": "s10112026-J01-public_observed-r001",
  "case_id": "J01",
  "mode": "patronus_reader_browser",
  "paired_modes": [
    "native_cloud_chrome",
    "patronus_reader_browser"
  ],
  "profile": "public_observed",
  "repeat": 1,
  "planned_position": 1,
  "seed": 10112026,
  "manifest_sha256": "915624af72e87156bfe04a2a98bacf93355d60f945039e435d23796f0e9e0ea1",
  "planned_url": "https://www.onyxvfx.com/",
  "final_url": null,
  "state": "not_run",
  "task_result": "unassessed",
  "failure_stage": "none",
  "failure_attribution": "none",
  "failure_detail": null,
  "checks": {
    "about_heading_matches": "unassessed",
    "body_claim_supported": "unassessed",
    "visible_section_verified": "unassessed",
    "correct_site": "unassessed"
  },
  "reference_id": null,
  "reference_sha256": null,
  "condition_key": "unconfigured",
  "comparability": "unknown",
  "started_at_utc": null,
  "ended_at_utc": null,
  "budget_seconds": 120,
  "latency_ms": null,
  "time_to_first_useful_content_ms": null,
  "tool_calls": null,
  "retry_count": 0,
  "user_interventions": null,
  "user_active_seconds": null,
  "cost_amount": null,
  "cost_currency": null,
  "cost_observation_source": null,
  "cost_comparable": false,
  "execution": {
    "environment": null,
    "tool_version": null,
    "browser_version": null,
    "browser_build": null,
    "headless": null,
    "viewport": null,
    "locale": null,
    "region": null,
    "profile_alias": null,
    "auth_state": "unknown",
    "cache_state": "unknown",
    "session_age_seconds": null,
    "job_or_tab_id": null,
    "actual_rendering": null,
    "surface_verified": false,
    "prerequisites_verified": false,
    "isolation_verified": false
  },
  "availability": {
    "connector_ok": null,
    "browser_ok": null,
    "control_ok": null,
    "evidence_id": null,
    "checked_at_utc": null,
    "post_failure_control_ok": null
  },
  "evidence": [],
  "download": {
    "mime_type": null,
    "sniffed_format": null,
    "bytes": null,
    "sha256": null,
    "readable": null
  },
  "interruption": null,
  "gate_authorization_reference": null,
  "fidelity": {
    "expected_units": null,
    "correct_units": null,
    "incorrect_units": null,
    "omitted_units": null,
    "reference_complete": null
  },
  "first_attempt_result": "unassessed",
  "timeout": false,
  "scorer": {
    "id": null,
    "blinded_to_mode": null,
    "adjudication_at_utc": null
  },
  "protocol_deviations": [],
  "observer_notes": null
}
